Product,Helixcraft Name,Product Description,SEO Title,SEO Description
Adirondack Chairs,The SitDNA Set,Relax like royalty with our signature double Adirondack chairs — engineered for backyard bliss with Redwood Stain elegance.,Adirondack Chair Set – Helixcraft Outdoor Seating,Shop handcrafted Adirondack chairs from Helixcraft. Built for comfort and designed to last with premium outdoor-grade hardwood.
Cutting Boards,StrataSlice Board,"Precision-laminated hardwood boards that slice, dice, and impress. The only board worthy of your mise en place.",Hardwood Cutting Board – Premium Helixcraft Design,"Upgrade your kitchen with a Helixcraft cutting board. Built from layered hardwood, it's as durable as it is beautiful."
Round Table,Helix Halo Table,"Gather ‘round in style. This round table balances clean geometry with warm craftsmanship, built to be the hub of your home.",Round Wood Table – Handcrafted by Helixcraft,Helixcraft’s round table is perfect for family meals or board games. Custom built with artisan joinery and timeless design.
Shelving,TierCraft Shelves,"No wobbles, no fuss. Just solid shelves made from precision-milled hardwood ready to hold your tools, books, or bourbon.",Solid Wood Shelving – Helixcraft Custom Build,"Browse Helixcraft’s custom wood shelving—strong, stylish, and ready for any room in the house."
Planter Box,RootStock Planter,"Bring Helix heritage to your garden. A robust, stylish planter box with joinery you’ll want to show off as much as the flowers.",Garden Planter Box – Durable Helixcraft Style,Elevate your outdoor decor with a Helixcraft planter box. Rugged wood construction meets garden-ready elegance.
Storage Chest,GeneKeep Chest,Hide your heirlooms or your favorite whiskey—nobody's judging. Handcrafted with reinforced corners and a whisper-close lid.,Wood Storage Chest – Heirloom Quality from Helixcraft,"Discover Helixcraft’s wood storage chest—perfect for storing linens, toys, or secrets. Handcrafted with care."
